,url,title,date,media_type
138,https://www.abc.net.au/news/2006-05-30/australia-gears-up-for-whaling-fight/1765824,Australia gears up for whaling fight,2006-05-30T02:41:00+00:00,article
139,https://www.abc.net.au/news/2006-05-30/aust-lobbies-pacific-islands-for-anti-whaling/1765760,Aust lobbies Pacific islands for anti-whaling support,2006-05-29T22:24:00+00:00,article
140,https://www.abc.net.au/news/2006-03-25/spacex-private-rocket-flight-a-bust/1716152,SpaceX private rocket flight a bust,2006-03-25T05:34:00+00:00,article
141,https://www.abc.net.au/news/2005-06-07/pacific-fisheries-agency-plans-resource-reforms/1587312,Pacific fisheries agency plans resource reforms,2005-06-06T23:21:00+00:00,article
142,https://www.abc.net.au/news/2005-05-06/illegal-fishing-boats-caught-in-pacific-net/1565330,Illegal fishing boats caught in Pacific net,2005-05-06T09:45:00+00:00,article
143,https://www.abc.net.au/news/2005-03-23/pacific-plan-on-agenda-for-leaders-in-nz/1538832,Pacific plan on agenda for leaders in NZ,2005-03-23T08:34:00+00:00,article
144,https://www.abc.net.au/news/2004-12-13/us-missile-defence-test-delayed-again/602076,US missile defence test delayed again,2004-12-13T09:20:00+00:00,article
145,https://www.abc.net.au/news/2004-10-16/marshall-is-atoll-sues-us-for-nuclear-damages/569600,Marshall Is atoll sues US for nuclear damages,2004-10-16T12:41:00+00:00,article
146,https://www.abc.net.au/news/2004-04-21/air-nauru-continues-despite-countrys-woes/173480,Air Nauru continues despite country's woes,2004-04-20T14:39:00+00:00,article
147,https://www.abc.net.au/news/2004-03-01/survivors-day-renews-marshall-is-aid-call/144366,Survivors day renews Marshall Is aid call,2004-03-01T06:05:00+00:00,article
148,https://www.abc.net.au/news/2004-02-01/nz-firm-to-manage-construction-in-marshall-islands/128796,NZ firm to manage construction in Marshall Islands,2004-02-01T05:43:00+00:00,article
149,https://www.abc.net.au/news/2003-12-04/marshall-islanders-unhappy-at-closure-of-health/100422,Marshall Islanders unhappy at closure of health program,2003-12-03T22:23:00+00:00,article
150,https://www.abc.net.au/news/2003-11-25/us-gives-nuked-pacific-islanders-aid-ship/1514322,US gives nuked Pacific Islanders aid ship,2003-11-24T13:32:00+00:00,article
151,https://www.abc.net.au/news/2003-11-17/marshall-islanders-to-vote-on-us-deal/1510154,Marshall Islanders to vote on US deal,2003-11-17T02:07:00+00:00,article
