,url,title,date,media_type
0,https://www.abc.net.au/news/2023-09-24/researchers-drawn-to-bikini-atoll-nuclear-turtles-spongebob/102862316,Nuclear bombs vaporised parts of the Bikini Atoll decades ago. What are the lasting impacts today?,2023-09-23T19:43:51+00:00,article
1,https://www.abc.net.au/news/science/2023-09-05/marshall-islands-sustainable-sea-transport-climate-canoes/102743722,"Faced with rising sea levels, the Marshall Islands are decarbonising ocean transport",2023-09-04T20:00:00+00:00,article
2,https://www.abc.net.au/news/2023-02-16/government-announces-3-000-visas-for-pacific-workers/101981264,'Very significant': Government to introduce bill for Pacific permanent residency visa,2023-02-15T21:34:53+00:00,article
3,https://www.abc.net.au/news/2023-02-14/joe-biden-pacific-islands-visit-pif-summit-micronesia/101974228,Pacific Island leaders announce Biden is set to visit the region in the 'near future'  ,2023-02-14T12:40:44+00:00,article
4,https://www.abc.net.au/news/2023-01-18/pacific-islands-japan-delay-release-fukushima-waste-fisheries/101869592,Pacific Islands urge Japan to delay release of Fukushima waste over contamination fears,2023-01-18T08:21:18+00:00,article
5,https://www.abc.net.au/news/2023-01-14/us-nears-new-cooperation-deals-with-pacific-island-nations/101856134,"Marshall Islands, Palau near new cooperation deals with US ",2023-01-14T07:06:15+00:00,article
6,https://www.abc.net.au/news/2022-08-16/health-disaster-declared-as-marshall-islands-ravaged-by-covid-19/101336376,Health disaster declared in Marshall Islands as COVID cases surge 'like wildfire',2022-08-15T14:25:59+00:00,article
7,https://www.abc.net.au/news/2022-07-20/micronesia-loses-covid-free-status-after-outbreak-confirmed/101254394,"Micronesia, previously one of the few remaining COVID-free countries, reports outbreak",2022-07-20T05:18:00+00:00,article
8,https://www.abc.net.au/news/2022-05-11/climate-change-effects-facts-causes-pacific-postcards/100999144,'We're going to lose this place': Postcards from the frontlines of climate change,2022-05-10T19:07:11+00:00,article
9,https://www.abc.net.au/news/2022-02-27/pasifika-women-demand-better-access-breastfeeding-rates-fall/100827788,'The look of disappointment': Why fewer Pacific Island women are nursing their babies  ,2022-02-26T17:58:56+00:00,article
10,https://www.abc.net.au/news/2022-02-14/pacific-islands-forum-head-to-be-replaced-panuelo-says/100827704,Micronesian leader says Pacific Islands Forum secretary-general will be replaced to keep body united,2022-02-14T06:15:30+00:00,article
11,https://www.abc.net.au/news/2022-02-12/pacific-islands-forum-split-stalls-at-last-minute-pif-fsm-puna/100825620,"The Pacific Islands Forum was set to split, but that's now been paused after 'substantive reforms' were agreed",2022-02-12T02:45:56+00:00,article
12,https://www.abc.net.au/news/2021-10-22/common-reporting-standard-tax-office-bouvet-island-bank-accounts/100556452,Bouvet Island is the most remote place on Earth. But its 'residents' still have $2.5m banked in Australian accounts,2021-10-21T19:02:18+00:00,article
13,https://www.abc.net.au/news/2021-10-02/pacific-blockchain-experiment-cryptocurrency-bitcoin/100495166,Why the Pacific has become a testing ground for blockchain and cryptocurrency projects,2021-10-01T19:16:56+00:00,article
14,https://www.abc.net.au/news/2021-08-10/greta-thunberg-ipcc-report-pacific-nations/100364164,Greta Thunberg says global warming's 'worst consequences' can be avoided,2021-08-10T06:30:07+00:00,article
15,https://www.abc.net.au/news/2021-07-09/china-criticises-australia-un-human-rights-council/100280736,China criticises Australia's human rights record at UN,2021-07-09T03:26:52+00:00,article
16,https://www.abc.net.au/news/2021-02-10/what-does-the-pacific-islands-forum-split-mean-for-australia/13137346,A deep rift has opened up among Pacific nations. What does it mean for Australia?,2021-02-10T04:40:07+00:00,article
17,https://www.abc.net.au/news/2021-01-08/why-are-hundreds-of-pacific-islands-getting-bigger/13038430,Why are hundreds of Pacific Islands growing despite rising sea levels?,2021-01-07T19:00:41+00:00,article
18,https://www.abc.net.au/news/2020-03-15/cars-that-eat-paradise-narrative-feature/12001916,"'Whole car bodies, thousands of parts': The cars that eat paradise",2020-03-14T19:20:20+00:00,article
19,https://www.abc.net.au/news/2019-08-17/bikini-atoll-beer-draws-criticism-from-marshall-islanders/11421880,"Death from Above, Bikini Atoll: Is naming beers after nuclear tests insensitive or a bit of fun?",2019-08-16T19:18:56+00:00,article
20,https://www.abc.net.au/news/2019-06-08/illness-on-enewetak-atoll-reignites-nuclear-contamination-fears/11181940,'Just like a lovely lollipop': Would you eat giant clams from a former nuclear test site?,2019-06-07T19:01:05+00:00,article
21,https://www.abc.net.au/news/2018-11-29/9th-asia-pacific-triennial-of-contemporary-art-brisbane-qagoma/10564222,Meet the neighbours in Australia's juggernaut exhibition of contemporary art from the Asia-Pacific,2018-11-28T19:08:20+00:00,article
22,https://www.abc.net.au/news/2018-03-24/marshall-islands-to-launch-digital-currency/9566370,Fears Marshall Islands 'contributing to own demise' by pursing digital currency as legal tender,2018-03-23T22:51:16+00:00,article
23,https://www.abc.net.au/news/2018-01-30/kathy-jetnil-kijiner-to-talk-climate-change-at-womadelaide/9370686,'My islands are sinking': Climate activist to feature at Womadelaide,2018-01-30T01:19:58+00:00,article
24,https://www.abc.net.au/news/redirects/backstory/television/2017-11-28/making-foreign-correspondent-marshall-islands-story/9194334,Surviving snoring and Spam in the Marshall Islands,2017-11-27T21:27:39+00:00,article
25,https://www.abc.net.au/news/2017-11-28/the-dome/9198340,The Dome,2017-11-27T20:27:26+00:00,video
26,https://www.abc.net.au/news/2017-11-28/the-toxic-legacy-of-a-deadly-paradise/9168422,"These soldiers cleaned up the US nuclear program, now they're paying with their lives",2017-11-27T19:14:33+00:00,article
27,https://www.abc.net.au/news/2017-11-27/the-dome-runit-island-nuclear-test-leaking-due-to-climate-change/9161442,"On a remote atoll, a concrete dome holds a leaking toxic timebomb",2017-11-26T18:48:31+00:00,article
28,https://www.abc.net.au/news/2017-11-27/9185308,The dome comes into view,2017-11-26T18:48:31+00:00,video
29,https://www.abc.net.au/news/2017-06-02/trump-likened-to-a-classroom-bully-after-climate-deal-backdown/8584960,Trump likened to 'classroom bully' after climate deal withdrawal,2017-06-02T08:23:30+00:00,article
30,https://www.abc.net.au/news/2017-05-17/marshall-islands-urge-australia-to-support-climate-change/8533434,Australia risking its international standing over climate change inaction: Marshall Islands,2017-05-17T06:02:53+00:00,article
31,https://www.abc.net.au/news/2017-03-02/pacific-nations-call-for-un-investigations-into-west-papua/8320194,Pacific nations call for UN investigations into West Papua,2017-03-02T11:06:58+00:00,article
32,https://www.abc.net.au/news/2017-01-09/internet-cable-repair-forces-marshall-islands-offline/8169484,Internet cable repair forces Marshall Islands offline,2017-01-09T02:12:21+00:00,article
33,https://www.abc.net.au/news/2016-11-16/island-leaders-ask-trump-for-a-change-of-heart-on-climate/8030082,Island leaders ask Trump to honour climate promises,2016-11-16T05:12:54+00:00,article
34,https://www.abc.net.au/news/2016-06-07/cocaine-shipment-washing-up-on-marshall-islands-beaches/7485460,Cocaine shipment washes up on Marshall Islands beaches,2016-06-07T03:57:19+00:00,article
35,https://www.abc.net.au/news/2016-01-27/hilda-heine-elected-first-ever-female-pacific-leader/7118664,Hilda Heine elected first female Pacific leader as president of Marshall Islands,2016-01-27T07:02:32+00:00,article
36,https://www.abc.net.au/news/programs/the-world/2015-12-01/story-of-survival-at-sea-turned-into-book/6988628,Story of survival at sea turned into book,2015-11-30T13:22:24+00:00,video
37,https://www.abc.net.au/news/2015-11-02/climate-change-the-focus-of-shortens-pacific-tour/6903832,Shorten to focus on climate change during Pacific tour,2015-11-01T18:56:11+00:00,article
38,https://www.abc.net.au/news/2015-08-11/marshall-islands-slams-australias-carbon-emissions-targets/6688974,Marshall Islands slams Australia's carbon emissions targets,2015-08-11T07:26:13+00:00,article
39,https://www.abc.net.au/news/2015-07-04/chaotic-unseasonal-storms-strike-marshall-islands-and-guam/6595124,Chaotic unseasonal storms strike Marshall Islands and Guam,2015-07-04T04:59:26+00:00,article
40,https://www.abc.net.au/news/2015-04-30/iran-detains-maersk-container-ship-over-decade-old-debt/6432364,Iran detains container ship over 'decade-old debt',2015-04-29T14:56:09+00:00,article
41,https://www.abc.net.au/news/2015-04-17/uss-independence-wwii-aircraft-carrier-found-in-pacific/6400012,'Amazingly intact' WWII US aircraft carrier found in Pacific,2015-04-17T01:28:58+00:00,article
42,https://www.abc.net.au/news/2015-02-09/marshall-islands-to-appeal-nuclear-ruling-say-advocates/6080486,"Marshall Islands to appeal nuclear ruling, say advocates",2015-02-09T08:38:46+00:00,article
43,https://www.abc.net.au/news/2014-12-22/global-warming-blamed-for-pacific-coral-bleaching/5983718,Global warming blamed for Pacific coral bleaching,2014-12-22T05:18:36+00:00,article
44,https://www.abc.net.au/news/2014-10-13/pacific-climate-warriors-to-protest-newcastle-coal-port/5809392,Pacific Climate Warriors to protest Newcastle coal port,2014-10-13T04:02:31+00:00,article
45,https://www.abc.net.au/news/2014-09-04/marshall-islands-calls-on-australia-to-rethink-climate-change-s/5720990,Marshall Islands urges Australia to rethink climate policy,2014-09-04T12:11:03+00:00,article
46,https://www.abc.net.au/news/2014-07-26/connect-the-blue-continent/5625472,Pacific urged to improve internet access and speed,2014-07-26T05:18:19+00:00,article
47,https://www.abc.net.au/news/2014-06-17/pacific-tuna-agreement/5530420,Pacific fishing nations warn more price rises ahead,2014-06-17T07:43:37+00:00,article
48,https://www.abc.net.au/news/2014-06-17/pacific-fishing-nations-to-receive-more-for-their/5530166,Pacific fishing nations to receive more for their tuna,2014-06-17T03:51:00+00:00,audio
49,https://www.abc.net.au/news/2014-06-13/pacific-presidents/5521478,Pacific leaders warn Australia isolated on climate change,2014-06-13T01:38:09+00:00,article
50,https://www.abc.net.au/news/2014-06-12/tuna-fees/5518936,Foreign tuna fishers face Pacific fee hike,2014-06-12T03:54:49+00:00,article
51,https://www.abc.net.au/news/2014-06-09/erosion-unearths-remains-of-japanese-soldiers-in-pacific/5510686,Erosion unearths remains of WWII Japanese soldiers in Pacific,2014-06-09T08:30:49+00:00,article
52,https://www.abc.net.au/news/2014-06-07/an-marshalls-climate-warn/5507464,Rising seas wash WWII soldier remains from graves,2014-06-06T23:06:46+00:00,article
53,https://www.abc.net.au/news/2014-05-27/measles-outbreak-has-marshalls-on-alert/5479934,Marshalls on alert after Micronesia measles outbreak,2014-05-26T22:23:00+00:00,article
54,https://www.abc.net.au/news/2014-04-25/marshall-islands-sues-nuclear-nations/5410792,Marshall Islands sues nuclear nations over failure to disarm,2014-04-24T15:18:15+00:00,article
55,https://www.abc.net.au/news/2014-04-03/an-virus-epidemnics/5364096,Pacific braces for impact of mosquito-borne virus epidemics,2014-04-03T00:23:51+00:00,article
56,https://www.abc.net.au/news/2014-04-01/an-marshall-islands-urges-urges-australia-to-take-22leadership/5360510,Marshall Islands unsure of Australia's climate stance,2014-04-01T11:36:39+00:00,article
57,https://www.abc.net.au/news/2014-03-16/emotional-shipwreck-survivor-meets-dead-mates-kin/5324194,Pacific castaway holds emotional meeting with dead mate's family,2014-03-16T03:48:30+00:00,article
58,https://www.abc.net.au/news/2014-03-04/marshall-islands-tidal-waves/5298646,Tidal flooding in Marshall Islands causes widespread damage,2014-03-04T11:19:54+00:00,article
59,https://www.abc.net.au/news/2014-03-04/tidal-floods-cause-damage-in-marshall-islands/5298868,Tidal floods cause damage in the Marshall Islands during 2014,2014-03-03T13:00:00+00:00,video
60,https://www.abc.net.au/news/2014-03-01/an-marshall-nuclear-test-loeak/5292886,Marshall Islands president calls for fairer nuclear test compensation,2014-03-01T03:24:49+00:00,article
61,https://www.abc.net.au/news/2014-02-28/an-marshall-island-youth-nuclear-survivor-day-conference/5290904,Marshall Islands marks 60 year nuclear anniversary,2014-02-28T04:04:41+00:00,article
62,https://www.abc.net.au/news/2014-02-16/an-pacific-castaway-alvarenga-story-back-by-us-study/5263066,Pacific castaway said to be now 'terrified' of ocean,2014-02-16T04:48:58+00:00,article
63,https://www.abc.net.au/news/2014-02-11/an-pacific-castaway-leaves-marshall-islands2c-heading-home-to-/5251056,Pacific castaway leaves Marshall Islands for home,2014-02-10T20:06:01+00:00,article
64,https://www.abc.net.au/news/2014-02-06/castaways-miracle-survival/5241390,Castaway's 'miracle' survival,2014-02-05T13:00:00+00:00,video
65,https://www.abc.net.au/news/2014-02-04/castaways-survival-story-plausible-experts-say/5237596,"Castaway's survival story is plausible, experts say",2014-02-04T05:19:31+00:00,article
66,https://www.abc.net.au/news/2014-02-03/an-mexican-man-washes-up-in-marshall-islands-after-more-than-a-/5233588,Castaway washes up on remote Pacific atoll,2014-02-02T21:25:43+00:00,article
67,https://www.abc.net.au/news/2014-01-21/an-climate-change/5210462,Pacific leader urges climate action,2014-01-20T23:48:33+00:00,article
68,https://www.abc.net.au/news/2014-01-14/an-marshall-islands-president-pleads-for-climate-change-action/5200284,Marshall Islands plea for action on climate change,2014-01-14T10:57:40+00:00,article
69,https://www.abc.net.au/news/2013-12-13/an2013---sean-dorney/5148884,The unforgettable voice of the Marshall Islands,2013-12-13T03:43:11+00:00,article
70,https://www.abc.net.au/news/2013-12-13/an2013-ten-of-the-best-portal/5152912,Asia Pacific 2013: Ten of the best stories from Australia Network News,2013-12-13T03:43:11+00:00,article
71,https://www.abc.net.au/news/2013-12-10/an-marshall-islands-sex-trafficking/5146032,Marshall Islands raises sex trafficking concerns,2013-12-09T22:04:02+00:00,article
72,https://www.abc.net.au/news/2013-11-21/an-marshalls-climate-minister-lashes-out-at-australia-and-japan/5106838,Marshall Islands hits out at Australia and Japan over carbon target cuts,2013-11-20T22:24:55+00:00,article
73,https://www.abc.net.au/news/2013-10-25/an-marshalls-bushfires/5044714,Anger in Marshalls over Abbott's climate remarks,2013-10-24T13:01:53+00:00,article
74,https://www.abc.net.au/news/2013-10-07/an-marshalls-no-confidence/5002566,No confidence motion in Marshallese President planned,2013-10-07T00:59:08+00:00,article
75,https://www.abc.net.au/news/2013-09-27/pacific-leaders-demand-climate-change-action/4984396,Pacific leaders demand climate change action,2013-09-27T01:05:44+00:00,article
76,https://www.abc.net.au/news/programs/the-world/2013-09-25/the-marshall-islands-unforgettable-voice/4981410,The Marshall Islands' unforgettable voice,2013-09-25T12:36:18+00:00,video
77,https://www.abc.net.au/news/programs/the-world/2013-09-24/marshall-islanders-continue-to-suffer-from-us/4979064,Marshall Islanders  suffer from US nuclear tests,2013-09-24T11:59:25+00:00,video
78,https://www.abc.net.au/news/programs/the-world/2013-09-12/marshall-islands-under-threat-from-rising-sea-level/4955014,Marshall Islands under threat from rising sea level,2013-09-12T13:14:48+00:00,video
79,https://www.abc.net.au/news/2013-09-10/pacific-nations-at-odds-over-a-tuna-pricing-scheme/4949620,Pacific nations at odds over tuna pricing scheme,2013-09-10T10:20:28+00:00,video
80,https://www.abc.net.au/news/2013-09-09/an-tuvalu-pm-calls-for-urgent-attention-to-climate-change-issues/4945174,Tuvalu PM calls for attention on climate change,2013-09-09T00:11:09+00:00,article
81,https://www.abc.net.au/news/2013-09-06/an-marshall-islands-gains-pacific-islands-forum-support-for-us-/4942154,Marshalls gains forum support for nuclear legacy,2013-09-06T11:17:32+00:00,article
82,https://www.abc.net.au/news/2013-09-06/pacific-islands-forum-ends-in-marshall-islands/4942134,Pacific Islands Forum ends in Marshall Islands,2013-09-06T10:23:42+00:00,video
83,https://www.abc.net.au/news/2013-09-06/an-marshalls-drought/4940982,Marshall Islands residents fear running out of water,2013-09-06T02:39:28+00:00,article
84,https://www.abc.net.au/news/2013-09-05/majuro-declaration-pacific-islands-forum/4939520,"Pacific countries lead the world on climate change, Majuro declaration",2013-09-05T12:26:24+00:00,article
85,https://www.abc.net.au/news/2013-09-05/pacific-leaders-adopt-majuro-declaration-on/4939204,Pacific leaders adopt Majuro Declaration on climate change,2013-09-05T09:14:14+00:00,video
86,https://www.abc.net.au/news/2013-09-04/an-pacific-islands-forum-opens-in-marshall-islands/4933432,Climate change dominates opening of Pacific talks,2013-09-03T22:32:04+00:00,article
87,https://www.abc.net.au/news/2013-09-03/pacific-nations-urged-to-show-leadership-on/4932900,Pacific nations urged to show leadership on climate change,2013-09-03T10:09:59+00:00,video
88,https://www.abc.net.au/news/2013-09-03/seized-shark-fins-dumped-in-pacific-ceremony/4932026,Marshall Islands dump shark fins,2013-09-03T04:17:57+00:00,article
89,https://www.abc.net.au/news/2013-09-03/an-climate-change-high-on-agenda-as-pacific-leaders-meet-in-mar/4930786,Pacific leaders to discuss climate change,2013-09-02T21:42:52+00:00,article
90,https://www.abc.net.au/news/2013-09-02/pacific-nations-to-consider-climate-declaration/4930412,Pacific nations to consider climate declaration,2013-09-02T11:08:36+00:00,video
91,https://www.abc.net.au/news/2013-09-01/an-shark-fin-decline-linked-to-china-corruption-crackdown/4927876,Shark fin decline linked to China's anti-graft push,2013-09-01T12:00:22+00:00,article
92,https://www.abc.net.au/news/2013-09-01/an-pac-summit/4927594,Pacific summit's climate change focus,2013-09-01T03:15:50+00:00,article
93,https://www.abc.net.au/news/2013-08-29/an-uninvited-oscar-temaru-to-attend-pacific-islands-forum/4920720,Uninvited Oscar Temaru to attend Pacific Forum,2013-08-28T22:28:51+00:00,article
94,https://www.abc.net.au/news/2013-08-28/an-eu-climate-comissioner-speaks-ahead-of-pif/4917792,EU urges Pacific to share climate change experience,2013-08-28T01:18:42+00:00,article
95,https://www.abc.net.au/news/2013-07-30/marshall-islands-calls-on-australia-to-show-new/4852386,Marshall Is calls on Australia to show climate leadership,2013-07-29T22:54:58+00:00,video
96,https://www.abc.net.au/news/2013-07-29/an-marshall-islands-calls-on-australia-to-tackle-climate-change/4851434,Marshall Islands seeks climate change support,2013-07-29T08:58:22+00:00,article
97,https://www.abc.net.au/news/2013-07-22/marshalls-sex-trafficking/4835354,Marshall Islands trafficking report 'totally baseless',2013-07-22T04:09:46+00:00,article
98,https://www.abc.net.au/news/2013-07-06/an-us-defence-missile-test-over-pacific-fails/4803744,US defence missile test fails over the Pacific,2013-07-06T06:00:48+00:00,article
99,https://www.abc.net.au/news/2013-06-28/marshall-islands-calls-for-regional-climate-leadership/4787510,Marshall Islands calls for regional climate leadership,2013-06-28T05:47:00+00:00,article
100,https://www.abc.net.au/news/2013-06-25/an-marshall-islands-braced-for-more-flooding/4779164,Marshall Islands bracing for more destructive seas,2013-06-25T06:54:30+00:00,article
101,https://www.abc.net.au/news/2013-06-19/an-no-unrest-in-marshall-islands3a-govermment/4764666,No drought-related unrest in Marshall Islands: minister,2013-06-19T00:34:10+00:00,article
102,https://www.abc.net.au/news/2013-06-13/an-australia-increases-drought-assistance-to-marshall-islands/4750408,Australia increases drought assistance to Marshall islands,2013-06-12T15:07:45+00:00,article
103,https://www.abc.net.au/news/2013-06-06/an-marshalls-drought-destroys-food-supplies2c-raises-tensions/4736522,"Marshalls drought destroys food, raises tensions",2013-06-05T22:06:32+00:00,article
104,https://www.abc.net.au/news/2013-05-15/unicef-provides-drought-aid-to-marshall-islands/4692404,UNICEF provides drought aid to Marshall Islands,2013-05-15T10:13:53+00:00,video
105,https://www.abc.net.au/news/2013-05-15/an-marshall-islands-drought-unicef-support/4691566,UNICEF provides drought aid to Marshall Islands,2013-05-15T05:21:17+00:00,article
106,https://www.abc.net.au/news/2013-05-10/marshalls-islands-declares-state-of-disaster/4682160,Marshall Islands declares state of disaster,2013-05-10T07:48:42+00:00,article
107,https://www.abc.net.au/news/2013-05-08/an_marshalls-drought/4676520,Marshall Islands drought set to worsen,2013-05-07T22:56:15+00:00,article
108,https://www.abc.net.au/news/2013-05-06/an-australian-aid-for-drought-affected-marshalls/4672534,Australian aid for drought-hit Marshall Islands,2013-05-06T05:31:40+00:00,article
109,https://www.abc.net.au/news/2013-04-26/an-marshall-islands-declares-state-of-emergency/4652438,Drought emergency declared in Marshall Islands,2013-04-25T22:20:44+00:00,article
110,https://www.abc.net.au/news/2013-04-03/an-marshall-islands-ordinance-clean-up/4606590,Plan to clear WW2 ordinance from Marshall Islands,2013-04-02T20:38:38+00:00,article
111,https://www.abc.net.au/news/2013-03-20/an_marshallbank_2003/4584072,Marshall Islands gets $3m communications boost,2013-03-20T02:03:05+00:00,article
112,https://www.abc.net.au/news/2012-12-20/an-marshall-islands-making-progress-on-underage-smoking/4437296,Marshall Islands making impact on underage smoking,2012-12-19T21:26:41+00:00,article
113,https://www.abc.net.au/news/2012-11-22/an-marshalls-pension-fund-unsustainable/4385448,Marshall Islands social security headed for crisis,2012-11-21T20:39:34+00:00,article
114,https://www.abc.net.au/news/2012-09-14/an-kiribati-fisherman-found-after-106-days-adrift/4262498,Kiribati fisherman found after 106 days adrift,2012-09-14T09:44:37+00:00,article
115,https://www.abc.net.au/news/2012-09-13/more-compensation-urged-over-marshalls-nuclear/4260184,More compensation urged over Marshalls nuclear tests,2012-09-13T08:19:10+00:00,video
116,https://www.abc.net.au/news/2012-08-31/an-pacific-islands-forum-leaders-begin-retreat/4234744,Pacific Islands Forum stands by Fiji suspension,2012-08-30T21:01:22+00:00,article
117,https://www.abc.net.au/news/2012-06-14/nasa-launches-black-hole-hunter/4069526,NASA telescope to hunt black holes,2012-06-13T20:01:31+00:00,article
118,https://www.abc.net.au/news/2011-11-28/pair-weak-after-month-adrift/3699296,Men found after month adrift in Pacific,2011-11-28T02:01:25+00:00,article
119,https://www.abc.net.au/news/2011-06-26/diabetes-rate-in-adults-doubles-since-1980/2772232,Diabetes rate in adults doubles since 1980,2011-06-26T06:17:00+00:00,article
120,https://www.abc.net.au/news/2011-03-12/pacific-escapes-tsunami-damage/2659126,Pacific escapes tsunami damage,2011-03-12T00:14:00+00:00,article
121,https://www.abc.net.au/news/2010-11-01/pacific-nation-plans-wall-to-block-rising-seas/2319732,Pacific nation plans wall to block rising seas,2010-11-01T07:15:00+00:00,article
122,https://www.abc.net.au/news/2010-07-28/rare-giant-coral-spotted-in-pacific/922882,Rare giant coral spotted in Pacific,2010-07-28T06:28:00+00:00,article
123,https://www.abc.net.au/news/2010-06-17/japan-pacific-nations-deny-whaling-bribery-claims/871194,"Japan, Pacific nations deny whaling bribery claims",2010-06-17T08:27:00+00:00,article
124,https://www.abc.net.au/news/2010-06-13/japan-bribing-small-nations-to-back-whaling/864794,Japan 'bribing' small nations to back whaling,2010-06-13T05:27:00+00:00,article
125,https://www.abc.net.au/news/2009-09-30/villages-wiped-out-by-killer-tsunami/1084422,Villages wiped out by killer tsunami,2009-09-29T19:00:00+00:00,article
126,https://www.abc.net.au/news/2009-08-07/rocket-island/1377506,Rocket Island,2009-08-07T02:31:00+00:00,video
127,https://www.abc.net.au/news/2009-01-13/govt-to-send-70k-aid-to-flood-damaged-pacific/264288,Govt to send $70k aid to flood-damaged Pacific Islands,2009-01-13T00:00:00+00:00,article
128,https://www.abc.net.au/news/2008-12-26/marshall-islands-in-major-clean-up/250382,Marshall Islands in 'major clean-up',2008-12-26T12:00:00+00:00,article
129,https://www.abc.net.au/news/2008-12-25/marshall-is-declares-emergency-over-floods/249896,Marshall Is declares emergency over floods,2008-12-25T04:00:00+00:00,article
130,https://www.abc.net.au/news/2008-06-09/us-sets-sights-on-marshall-is-bombing-mission/2464092,US sets sights on Marshall Is bombing mission,2008-06-08T23:36:00+00:00,article
131,https://www.abc.net.au/news/2007-09-17/coconut-oil-powering-an-alternative-in-the-pacific/671696,Coconut oil powering an alternative in the Pacific,2007-09-16T20:49:00+00:00,article
132,https://www.abc.net.au/news/2007-06-24/islanders-block-us-missile-testing-range/79050,Islanders block US missile testing range,2007-06-24T08:00:00+00:00,article
133,https://www.abc.net.au/news/2006-12-14/pacific-island-nations-plan-joint-airline/2153846,Pacific island nations plan joint airline,2006-12-14T10:00:00+00:00,article
134,https://www.abc.net.au/news/2006-09-09/pacific-islanders-survive-34-days-adrift/1259742,Pacific islanders survive 34 days adrift,2006-09-09T07:23:00+00:00,article
135,https://www.abc.net.au/news/2006-06-20/nz-angry-over-pacific-islands-pro-whaling-votes/1782086,NZ angry over Pacific islands' pro-whaling votes,2006-06-20T02:01:00+00:00,article
136,https://www.abc.net.au/news/2006-06-01/senator-still-confident-for-anti-whaling-votes/1767380,Senator still confident for anti-whaling votes,2006-05-31T23:27:00+00:00,article
137,https://www.abc.net.au/news/2006-05-31/marshall-is-to-join-whaling-commission/1766700,Marshall Is to join whaling commission,2006-05-31T02:46:00+00:00,article
